{
  "source_id": "S001",
  "provider": "fixture",
  "retrieval_method": "mocked source fixture",
  "title": "Synthetic official dataset sample",
  "canonical_url": "https://example.org/fixture",
  "publisher": "Synthetic fixture",
  "publication_date": "2026-01-01",
  "event_date": null,
  "retrieved_at": "2026-10-23T00:00:00Z",
  "country_or_market": "Exampleland",
  "industry_category": "software",
  "evidence_type": "official dataset (synthetic)",
  "claim_or_finding": "Synthetic fixture only; not market evidence.",
  "excerpt_or_paraphrase": null,
  "relevance": "Used for offline schema validation.",
  "reliability_tier": "unknown",
  "primary_or_secondary": "unknown",
  "independence_cluster": null,
  "limitations": ["Synthetic test fixture; never cite as a live source."],
  "corroborating_source_ids": [],
  "contradicting_source_ids": [],
  "verification_status": "opened",
  "operation_id": null
}
